{
  "id": "EV-001",
  "claim": "38% of SMB admins abandon setup at step 3",
  "metric": "setup_step3_abandon_rate",
  "value": 0.38,
  "segment": "smb_admin",
  "period": "2026-07-01..2026-09-30",
  "n": 12450,
  "source": "warehouse",
  "query_id": "setup_funnel_v2",
  "query_hash": "abc123def456",
  "run_at": "2026-10-03T10:00:00Z",
  "confidence": "high",
  "caveats": ["excludes trial accounts"],
  "supports_problem": "PB-001"
}
